{"$id":"https://cheapinfra-resources.wyrdwerk.com/api/v1/schemas/resource.schema.json","$schema":"https://json-schema.org/draft/2020-12/schema","additionalProperties":false,"description":"One normalized public record per library resource. Unknown factual metadata is null or omitted, never inferred.","properties":{"brief":{"maxLength":1200,"minLength":1,"type":"string"},"canonical_url":{"description":"Primary destination. HTTPS only (observed baseline); unique across the catalog.","maxLength":2048,"pattern":"^https://[^\\s]+$","type":"string"},"caveat":{"maxLength":600,"type":["string","null"]},"display_period":{"description":"Legacy week label for site rendering.","type":"string"},"id":{"description":"Immutable slug identity. Never regenerated after creation.","pattern":"^[a-z0-9][a-z0-9-]{2,95}$","type":"string"},"interfaces":{"default":[],"items":{"enum":["api","cli","desktop","extension","mcp","web"]},"maxItems":5,"type":"array","uniqueItems":true},"legacy_categories":{"description":"Compatibility only: the frozen six site categories.","items":{"enum":["ai-tool","dev-tool","github","web-app","article","providers"]},"minItems":1,"type":"array","uniqueItems":true},"license":{"description":"Only when verified from the source; never inferred.","type":["string","null"]},"open_source":{"description":"Unknown stays null.","type":["boolean","null"]},"resource_type":{"enum":["article-guide","dataset","directory-gallery","documentation","library-framework","other","provider","repository","service-platform","template-starter","tool"],"type":"string"},"schema_version":{"const":"1.0"},"shared_on":{"description":"ISO 8601 calendar date with traceable source evidence. Rows without resolvable evidence are blocked in the migration exceptions file, not backfilled.","format":"date","type":"string"},"source":{"additionalProperties":false,"properties":{"channel":{"enum":["share-tech","providers"]},"sharer":{"maxLength":80,"minLength":1,"type":"string"}},"required":["channel","sharer"],"type":"object"},"technologies":{"default":[],"items":{"enum":["anthropic-api","claude-code","docker","electron","github-actions","go","javascript","kubernetes","mcp-protocol","neovim","next-js","node-js","ollama","openai-api","postgres","python","react","rust","sqlite","svelte","tailwind-css","typescript","vscode","vue","zed"]},"maxItems":8,"type":"array","uniqueItems":true},"title":{"maxLength":160,"minLength":1,"type":"string"},"topics":{"items":{"enum":["ai-agents","app-development","backend","cloud-infrastructure","databases","design","developer-tools","devops","frontend","inference","observability","productivity","security","self-hosting","testing","web-development"]},"maxItems":5,"minItems":1,"type":"array","uniqueItems":true},"use_cases":{"items":{"enum":["automate-workflows","build-interfaces","create-media","deploy-applications","discover-design-references","generate-code","host-models","learn-technique","manage-agents","monitor-systems","operate-databases","provision-infrastructure","run-inference","search-code","test-software"]},"maxItems":6,"minItems":1,"type":"array","uniqueItems":true},"verification":{"additionalProperties":false,"properties":{"checked_at":{"format":"date-time","type":["string","null"]},"final_url":{"pattern":"^https://[^\\s]+$","type":["string","null"]},"status":{"enum":["reachable","unreachable","unchecked"]}},"required":["status"],"type":"object"}},"required":["schema_version","id","title","canonical_url","brief","resource_type","topics","use_cases","source","shared_on"],"title":"Canonical resource record","type":"object"}