{
  "schema_version": "1.0",
  "id": "kolu",
  "title": "kolu",
  "canonical_url": "https://kolu.dev/",
  "brief": "A terminal tool that bills itself as \"the best way to run terminals\". Details unverified, but worth a look if your terminal setup needs rethinking.",
  "caveat": "Details unverified, but worth a look if your terminal setup needs rethinking.",
  "resource_type": "tool",
  "topics": [
    "developer-tools"
  ],
  "use_cases": [
    "automate-workflows"
  ],
  "interfaces": [
    "cli"
  ],
  "technologies": [],
  "license": null,
  "open_source": null,
  "display_period": "20–27 Aug 2026",
  "legacy_categories": [
    "dev-tool",
    "web-app"
  ],
  "source": {
    "channel": "share-tech",
    "sharer": "Alp"
  },
  "shared_on": "2026-08-21",
  "verification": {
    "status": "unchecked",
    "checked_at": null,
    "final_url": null
  }
}
