{
  "schema_version": "1.0",
  "id": "openference",
  "title": "OpenFerence",
  "canonical_url": "https://openference.ai/",
  "brief": "Inference API at openference.ai; public evidence is snippet-based only. A Discord claim that its GLM 5.2 \"is not even real\" is unverified.",
  "caveat": "A Discord claim that its GLM 5.2 \"is not even real\" is unverified.",
  "resource_type": "provider",
  "topics": [
    "inference"
  ],
  "use_cases": [
    "run-inference"
  ],
  "interfaces": [
    "api"
  ],
  "technologies": [],
  "license": null,
  "open_source": null,
  "display_period": "providers",
  "legacy_categories": [
    "providers"
  ],
  "source": {
    "channel": "providers",
    "sharer": "Tom"
  },
  "shared_on": "2026-08-17",
  "verification": {
    "status": "unchecked",
    "checked_at": null,
    "final_url": null
  }
}
