{
  "schema_version": "1.0",
  "id": "treg",
  "title": "treg",
  "canonical_url": "https://treg.to/",
  "brief": "A tool catalog for agents — 2,630 endpoints across 47 providers (SEO, social, enrichment, ads data) callable with one key, priced per call, plus support for your own keys and skills. Tom's 2 Sep share carried his referral param; normalized to the root domain.",
  "caveat": null,
  "resource_type": "service-platform",
  "topics": [
    "ai-agents",
    "backend"
  ],
  "use_cases": [
    "manage-agents"
  ],
  "interfaces": [
    "api"
  ],
  "technologies": [],
  "license": null,
  "open_source": null,
  "display_period": "27 Aug–3 Sep 2026",
  "legacy_categories": [
    "ai-tool",
    "web-app"
  ],
  "source": {
    "channel": "share-tech",
    "sharer": "Tom"
  },
  "shared_on": "2026-09-02",
  "verification": {
    "status": "unchecked",
    "checked_at": null,
    "final_url": null
  }
}
