{
  "schema_version": "1.0",
  "id": "kiro-fabric",
  "title": "kiro-fabric",
  "canonical_url": "https://github.com/asx8678/kiro-fabric",
  "brief": "Kiro Fabric gives Kiro CLI a way to run several tool operations as one checked TypeScript program: Kiro writes the code, Fabric type-checks it and executes it in a fresh QuickJS context, with a repo-navigation layer (Navigator/Fovea) mapping symbols and change impact via ast-grep. Fresh repo (0 stars, MIT); expect rough edges.",
  "caveat": "Fresh repo (0 stars, MIT); expect rough edges.",
  "resource_type": "repository",
  "topics": [
    "developer-tools",
    "ai-agents"
  ],
  "use_cases": [
    "manage-agents"
  ],
  "interfaces": [
    "cli"
  ],
  "technologies": [
    "typescript"
  ],
  "license": null,
  "open_source": null,
  "display_period": "24 Sep–1 Oct 2026",
  "legacy_categories": [
    "dev-tool",
    "github"
  ],
  "source": {
    "channel": "share-tech",
    "sharer": "asx"
  },
  "shared_on": "2026-09-27",
  "verification": {
    "status": "unchecked",
    "checked_at": null,
    "final_url": null
  }
}
