{
  "schema_version": "1.0",
  "id": "freebuff",
  "title": "Freebuff",
  "canonical_url": "https://freebuff.com/",
  "brief": "Free, ad-supported coding agent (CLI, desktop, web, cloud, chat) powered by open models like DeepSeek V4 Pro/Flash and MiniMax M3. Explicit no-training stance — it doesn't share data with third parties that would train on it.",
  "caveat": null,
  "resource_type": "tool",
  "topics": [
    "ai-agents"
  ],
  "use_cases": [
    "generate-code",
    "manage-agents"
  ],
  "interfaces": [
    "cli",
    "desktop",
    "web"
  ],
  "technologies": [],
  "license": null,
  "open_source": null,
  "display_period": "providers",
  "legacy_categories": [
    "providers"
  ],
  "source": {
    "channel": "providers",
    "sharer": "Rykuuun"
  },
  "shared_on": "2026-08-14",
  "verification": {
    "status": "unchecked",
    "checked_at": null,
    "final_url": null
  }
}
