{
  "schema_version": "1.0",
  "id": "surplus-intelligence",
  "title": "Surplus Intelligence",
  "canonical_url": "https://www.surplusintelligence.ai/",
  "brief": "OpenAI-compatible inference marketplace that routes each request to the cheapest current offer. Vendor claims ~38% savings via routing; pricing and retention terms weren't independently verified.",
  "caveat": null,
  "resource_type": "provider",
  "topics": [
    "inference"
  ],
  "use_cases": [
    "run-inference"
  ],
  "interfaces": [
    "api"
  ],
  "technologies": [],
  "license": null,
  "open_source": null,
  "display_period": "providers",
  "legacy_categories": [
    "providers"
  ],
  "source": {
    "channel": "providers",
    "sharer": "Felix"
  },
  "shared_on": "2026-09-17",
  "verification": {
    "status": "unchecked",
    "checked_at": null,
    "final_url": null
  }
}
