{
  "schema_version": "1.0",
  "id": "telnyx",
  "title": "Telnyx",
  "canonical_url": "https://telnyx.com/pricing/inference-api",
  "brief": "Inference API with published per-token pricing — Kimi K3 at $2.70/M input, $0.27/M cached input, $13.50/M output. The sharer noted they're open to negotiating volume pricing.",
  "caveat": null,
  "resource_type": "provider",
  "topics": [
    "inference"
  ],
  "use_cases": [
    "run-inference"
  ],
  "interfaces": [
    "api"
  ],
  "technologies": [],
  "license": null,
  "open_source": null,
  "display_period": "providers",
  "legacy_categories": [
    "providers"
  ],
  "source": {
    "channel": "providers",
    "sharer": "thelaggingway"
  },
  "shared_on": "2026-07-28",
  "verification": {
    "status": "unchecked",
    "checked_at": null,
    "final_url": null
  }
}
