{
  "schema_version": "1.0",
  "id": "gliner2-5-decide",
  "title": "GLiNER2.5-Decide",
  "canonical_url": "https://fastino.ai/blog/gliner-2-5-decide-open-weight-decision-model",
  "brief": "Fastino's 340M-parameter open-weight model for schema-defined decision-making: feed it text plus typed questions and get valid answers with probabilities, confidence scores, and constraint-feasibility metadata. Apache 2.0, CPU-capable, strong on routing/triage/guardrail tasks. Benchmark figures are vendor-reported and not independently verified.",
  "caveat": "Benchmark figures are vendor-reported and not independently verified.",
  "resource_type": "article-guide",
  "topics": [
    "inference"
  ],
  "use_cases": [
    "learn-technique"
  ],
  "interfaces": [],
  "technologies": [],
  "license": null,
  "open_source": null,
  "display_period": "24 Sep–1 Oct 2026",
  "legacy_categories": [
    "article",
    "ai-tool"
  ],
  "source": {
    "channel": "share-tech",
    "sharer": "Tom"
  },
  "shared_on": "2026-09-25",
  "verification": {
    "status": "unchecked",
    "checked_at": null,
    "final_url": null
  }
}
