{
  "schema_version": "1.0",
  "id": "amicro",
  "title": "Amicro",
  "canonical_url": "https://amicro.vercel.app/",
  "brief": "A curated gallery of premium React micro-interaction and transition components built with React and Motion, with layout inspired by transition.dev. It showcases around 36 named interactions — morph, glare shine, magnetic field, text reveal, focus blur, shake, rotate, color-morph buttons — as ready-to-use UI components. Licensing and copy-paste terms are not stated on the page, so reusability is uncertain.",
  "caveat": null,
  "resource_type": "directory-gallery",
  "topics": [
    "frontend",
    "design"
  ],
  "use_cases": [
    "build-interfaces",
    "discover-design-references"
  ],
  "interfaces": [
    "web"
  ],
  "technologies": [
    "react"
  ],
  "license": null,
  "open_source": null,
  "display_period": "23–29 Jul 2026",
  "legacy_categories": [
    "web-app"
  ],
  "source": {
    "channel": "share-tech",
    "sharer": "Tom"
  },
  "shared_on": "2026-07-25",
  "verification": {
    "status": "unchecked",
    "checked_at": null,
    "final_url": null
  }
}
