{
  "schema_version": "1.0",
  "id": "merge-gateway",
  "title": "Merge Gateway",
  "canonical_url": "https://merge.dev/",
  "brief": "Multi-provider gateway. A Discord-shared \"75% off DeepSeek V4 Flash through September 30\" promo was not corroborated on its site.",
  "caveat": null,
  "resource_type": "provider",
  "topics": [
    "inference"
  ],
  "use_cases": [
    "run-inference"
  ],
  "interfaces": [
    "api"
  ],
  "technologies": [],
  "license": null,
  "open_source": null,
  "display_period": "providers",
  "legacy_categories": [
    "providers"
  ],
  "source": {
    "channel": "providers",
    "sharer": "0xSaiya"
  },
  "shared_on": "2026-08-24",
  "verification": {
    "status": "unchecked",
    "checked_at": null,
    "final_url": null
  }
}
