{
  "schema_version": "1.0",
  "id": "kitesurf-cloudflare-blog",
  "title": "Kitesurf (Cloudflare blog)",
  "canonical_url": "https://blog.cloudflare.com/kitesurf/",
  "brief": "Cloudflare's announcement of Kitesurf, a headless browser built for AI agents that runs entirely on Cloudflare Workers in V8 isolates instead of Chromium — optimized for token efficiency and scale on agentic tasks like screenshots and HTML extraction. The post walks through the engineering (Rust compiled to Wasm, Blitz/Stylo rendering, Chrome DevTools Protocol compatibility), reports 215,000+ Web Platform Tests passing, and availability free during beta inside Browser Run. Benchmark and conformance claims are vendor-reported and not independently verified.",
  "caveat": "Benchmark and conformance claims are vendor-reported and not independently verified.",
  "resource_type": "article-guide",
  "topics": [
    "ai-agents",
    "developer-tools"
  ],
  "use_cases": [
    "learn-technique"
  ],
  "interfaces": [
    "web"
  ],
  "technologies": [
    "rust"
  ],
  "license": null,
  "open_source": null,
  "display_period": "6–12 Aug 2026",
  "legacy_categories": [
    "article"
  ],
  "source": {
    "channel": "share-tech",
    "sharer": "whaaaat"
  },
  "shared_on": "2026-08-07",
  "verification": {
    "status": "unchecked",
    "checked_at": null,
    "final_url": null
  }
}
