{
  "schema_version": "1.0",
  "id": "gps-01-interactive-gps-explainer",
  "title": "GPS-01 — interactive GPS explainer",
  "canonical_url": "https://gps-01.dmytro.fyi/",
  "brief": "A tiny interactive explainer of how your phone finds itself — satellites, signal timing, and trilateration. The good kind of technical storytelling.",
  "caveat": null,
  "resource_type": "article-guide",
  "topics": [
    "frontend"
  ],
  "use_cases": [
    "learn-technique"
  ],
  "interfaces": [
    "web"
  ],
  "technologies": [],
  "license": null,
  "open_source": null,
  "display_period": "13–20 Aug 2026",
  "legacy_categories": [
    "web-app",
    "article"
  ],
  "source": {
    "channel": "share-tech",
    "sharer": "Tom"
  },
  "shared_on": "2026-08-19",
  "verification": {
    "status": "unchecked",
    "checked_at": null,
    "final_url": null
  }
}
