{
  "schema_version": "1.0",
  "id": "makora",
  "title": "Makora",
  "canonical_url": "https://www.makora.com/",
  "brief": "Inference provider and optimization service — Starter $20/mo and Developer $200/mo (both shown sold out), with private model serving and on-prem options. Starter covers unlimited models under 40B parameters.",
  "caveat": null,
  "resource_type": "provider",
  "topics": [
    "inference"
  ],
  "use_cases": [
    "run-inference"
  ],
  "interfaces": [
    "api"
  ],
  "technologies": [],
  "license": null,
  "open_source": null,
  "display_period": "providers",
  "legacy_categories": [
    "providers"
  ],
  "source": {
    "channel": "providers",
    "sharer": "0xSaiya"
  },
  "shared_on": "2026-07-25",
  "verification": {
    "status": "unchecked",
    "checked_at": null,
    "final_url": null
  }
}
