{
  "schema_version": "1.0",
  "id": "inferhub",
  "title": "InferHub",
  "canonical_url": "https://inferhub.dev/pricing",
  "brief": "Proxy service that pools AI subscriptions into one API. Shared as \"a rly interesting proxy\" with per-plan pricing on its site.",
  "caveat": null,
  "resource_type": "provider",
  "topics": [
    "inference"
  ],
  "use_cases": [
    "run-inference"
  ],
  "interfaces": [
    "api"
  ],
  "technologies": [],
  "license": null,
  "open_source": null,
  "display_period": "providers",
  "legacy_categories": [
    "providers"
  ],
  "source": {
    "channel": "providers",
    "sharer": "one_phantomic"
  },
  "shared_on": "2026-09-21",
  "verification": {
    "status": "unchecked",
    "checked_at": null,
    "final_url": null
  }
}
