{
  "schema_version": "1.0",
  "id": "antidoom-liquid-ai-blog",
  "title": "Antidoom (Liquid AI blog)",
  "canonical_url": "https://www.liquid.ai/blog/antidoom",
  "brief": "Liquid AI's method for killing the repetitive 'doom loops' that plague small reasoning models: Final Token Preference Optimization trains the model to prefer coherent alternatives at the exact token where a loop begins, leaving the rest of the distribution untouched. On an early LFM2.5-2.6B checkpoint it cut loop rates from 10.2% to 1.4%, and on Qwen3.5-4B from 22.9% to 1% under greedy sampling — with the generation, detection, and training code open-sourced. Results are vendor-reported on vendor checkpoints and not independently verified.",
  "caveat": "Results are vendor-reported on vendor checkpoints and not independently verified.",
  "resource_type": "article-guide",
  "topics": [
    "inference"
  ],
  "use_cases": [
    "learn-technique"
  ],
  "interfaces": [],
  "technologies": [],
  "license": null,
  "open_source": true,
  "display_period": "30 Jul–5 Aug 2026",
  "legacy_categories": [
    "article"
  ],
  "source": {
    "channel": "share-tech",
    "sharer": "whaaaat"
  },
  "shared_on": "2026-08-03",
  "verification": {
    "status": "unchecked",
    "checked_at": null,
    "final_url": null
  }
}
