{
  "schema_version": "1.0",
  "id": "boat",
  "title": "boat",
  "canonical_url": "https://boat.dev/",
  "brief": "Boat sells cloud sandbox VMs for long-running agents: full VMs (Docker, systemd, databases), an integrated desktop/browser, and a CLI (`boat new`, `boat prompt` runs Claude Code or Codex inside), API, and SDKs, with stop/resume snapshots that pause billing. They claim $0.036/h for 4 vCPU / 8 GB RAM on a $20/mo plan ($20 of sandbox time), with a price table pitching themselves well under E2B, Daytona, Modal, and Vercel Sandbox. These price comparisons are the vendor's own and are not independently verified.",
  "caveat": "These price comparisons are the vendor's own and are not independently verified.",
  "resource_type": "service-platform",
  "topics": [
    "ai-agents",
    "cloud-infrastructure",
    "developer-tools"
  ],
  "use_cases": [
    "manage-agents"
  ],
  "interfaces": [
    "cli",
    "api"
  ],
  "technologies": [
    "docker",
    "claude-code"
  ],
  "license": null,
  "open_source": null,
  "display_period": "24 Sep–1 Oct 2026",
  "legacy_categories": [
    "dev-tool",
    "web-app"
  ],
  "source": {
    "channel": "share-tech",
    "sharer": "Tom"
  },
  "shared_on": "2026-09-28",
  "verification": {
    "status": "unchecked",
    "checked_at": null,
    "final_url": null
  }
}
