{
  "schema_version": "1.0",
  "id": "the-next-git-platform-on-cloudflare",
  "title": "The next Git platform on Cloudflare",
  "canonical_url": "https://blog.cloudflare.com/next-git-platform-on-cloudflare/",
  "brief": "Cloudflare's blog announces a competition to build the next Git platform on Cloudflare, aimed at an AI-agent era of coding. Read it for the contest details and Cloudflare's take on where agent-driven development tooling is headed.",
  "caveat": null,
  "resource_type": "article-guide",
  "topics": [
    "ai-agents",
    "developer-tools"
  ],
  "use_cases": [
    "learn-technique"
  ],
  "interfaces": [],
  "technologies": [],
  "license": null,
  "open_source": null,
  "display_period": "1–8 Oct 2026",
  "legacy_categories": [
    "article"
  ],
  "source": {
    "channel": "share-tech",
    "sharer": "thelaggingway"
  },
  "shared_on": "2026-10-01",
  "verification": {
    "status": "unchecked",
    "checked_at": null,
    "final_url": null
  }
}
